<?xml version="1.0" encoding="UTF-8"?>
<xs:schema xmlns:xs="http://www.w3.org/2001/XMLSchema" targetNamespace="http://www.uniovi.es"
    xmlns="http://www.uniovi.es" elementFormDefault="qualified">

    <xs:element name="forml">
        <xs:complexType>
            <xs:sequence>
                <xs:element ref="header"/>
                <xs:element ref="body"/>
            </xs:sequence>
        </xs:complexType>
    </xs:element>

    <xs:element name="header">
        <xs:complexType/>
            <xs:sequence>
                <xs:element name="title" type="xs:string"/>
                <xs:element name="description" type="xs:string"/>
            </xs:sequence>
        </xs:complexType>
    </xs:element>

    <xs:element name="body">
        <xs:complexType/>
            <xs:sequence>
                <xs:element minOccurs="1" maxOccurs="unbounded" ref="section"/>
            </xs:sequence>
        </xs:complexType>
    </xs:element>

    <xs:element name="section">
        <xs:complexType/>
            <xs:choice>
                <xs:element minOccurs="1" maxOccurs="unbounded" ref="section"/>
                <xs:element minOccurs="1" maxOccurs="unbounded" ref="question"/>
            </xs:choice>
            <xs:attribute name="name" type="xs:string" use="required"/>
        </xs:complexType>
    </xs:element>

    <xs:element name="question">
        <xs:complexType/>
            <xs:sequence>
                <xs:element minOccurs="4" maxOccurs="4" ref="option"/>
            </xs:sequence>
            <xs:attribute name="text" type="xs:string" use="required"/>
            <xs:attribute name="accepted" type="validAnswer" use="required"/>
        </xs:complexType>
    </xs:element>

    <xs:element name="option">
        <xs:complexType/>
            <xs:attribute name="text" type="xs:string" use="required"/>
        </xs:complexType>
    </xs:element>

    <xs:element>
        <xs:simpleType name="validAnswerType">
            <xs:restriction base="xs:string">
                <xs:enumeration value="a"/>
                <xs:enumeration value="b"/>
                <xs:enumeration value="c"/>
                <xs:enumeration value="d"/>
            </xs:restriction>
        <xs:simpleType/>
    </xs:element>

</xs:schema>